{
  "$schema": "../../schema/registry-manifest.schema.json",
  "manifestVersion": "0.1.0",
  "kind": "ruleset",
  "id": "axioval:example.ruleset",
  "version": "0.1.0",
  "schemaVersion": "0.1.0",
  "entrypoint": "ruleset.pkl",
  "definitionEntrypoints": ["definitions.pkl"],
  "description": "Non-production package used to validate the Axioval schema."
}
