{
  "$schema": "../../schema/registry-manifest.schema.json",
  "manifestVersion": "0.1.0",
  "kind": "ruleset",
  "id": "axioval:example.geometry-clearance",
  "version": "0.1.0",
  "schemaVersion": "0.1.0",
  "entrypoint": "ruleset.pkl",
  "definitionEntrypoints": ["definitions.pkl"],
  "description": "Instructional IFC4X3 directional-clearance package using specialized Pkl dependencies."
}
